{
  "engine_python_parity": {
    "failures": [],
    "observed": {
      "configural_chi_square_absolute_difference": 4.68247662865906e-10,
      "label_swap_status": "accepted",
      "lrt_absolute_difference": 4.3510084424269735e-10,
      "lrt_p_value_absolute_difference": 4.735724616275472e-14,
      "maximum_group_objective_absolute_difference": 3.450625563061749e-08,
      "maximum_implied_covariance_absolute_difference": 7.30937723125713e-07,
      "maximum_label_swap_chi_square_absolute_difference": 5.471179065352771e-13,
      "maximum_moment_absolute_difference": 0.0,
      "maximum_parameter_absolute_difference": 2.925400637551756e-06,
      "metric_chi_square_absolute_difference": 3.3146818623208674e-11
    },
    "status": "accepted",
    "tolerances": {
      "chi_square_absolute": 1e-06,
      "implied_covariance_absolute": 0.0001,
      "label_swap_absolute": 1e-07,
      "lavaan_chi_square_absolute": 0.001,
      "moment_absolute": 1e-12,
      "objective_absolute": 1e-07,
      "p_value_absolute": 1e-09,
      "parameter_absolute": 0.0001
    }
  },
  "engine_reference": {
    "binary_sha256": "797285276571d0170f893ccd2e8021122d164f36c474046164d2d1c471a3024b",
    "configural": {
      "chi_square": 16.842105249477903,
      "degrees_of_freedom": 16,
      "free_dimensions": 26,
      "gradient_norm": 8.15781677549049e-08,
      "groups": [
        {
          "chi_square": 8.501617508427728,
          "group": "A",
          "implied_covariance_sha256": "31d1c829eb45671b95d8dfcdf1a139ffd82764599df221a97af5b727ee1f1cee",
          "objective": 0.047231208380154044,
          "parameters": {
            "factor_covariance_f1_f2": 0.38769627520406014,
            "factor_variance_f1": 1.1910930235493165,
            "factor_variance_f2": 0.8617563693798477,
            "loading_x1": 1.0,
            "loading_x2": 0.6244435540496779,
            "loading_x3": 0.5787447316217341,
            "loading_y1": 1.0,
            "loading_y2": 0.6834756458870701,
            "loading_y3": 0.7100192473001135,
            "residual_variance_x1": 0.17518789719489514,
            "residual_variance_x2": 0.3742531240190963,
            "residual_variance_x3": 0.530559939515349,
            "residual_variance_y1": 0.3128960524790551,
            "residual_variance_y2": 0.33447577432852915,
            "residual_variance_y3": 0.3566855916445883
          },
          "sample_size": 180
        },
        {
          "chi_square": 8.340487741050175,
          "group": "B",
          "implied_covariance_sha256": "cdcedf4554aeb33b47ee170fdcfd06eb373e612058c06ae042be47f5dda13679",
          "objective": 0.037911307913864434,
          "parameters": {
            "factor_covariance_f1_f2": 0.3047700102989061,
            "factor_variance_f1": 1.008910024836305,
            "factor_variance_f2": 1.0248848161733206,
            "loading_x1": 1.0,
            "loading_x2": 0.658793649104385,
            "loading_x3": 0.24527049802677095,
            "loading_y1": 1.0,
            "loading_y2": 0.7316901918850061,
            "loading_y3": 0.6468279768796181,
            "residual_variance_x1": 0.05281282357748404,
            "residual_variance_x2": 0.5225966806100026,
            "residual_variance_x3": 0.38168248935911797,
            "residual_variance_y1": 0.3834695352288537,
            "residual_variance_y2": 0.4151088798937341,
            "residual_variance_y3": 0.5016293317522619
          },
          "sample_size": 220
        }
      ],
      "objective": 0.04210526312369476,
      "observed_moments": 42
    },
    "data_authority": {
      "combined_authority_sha256": "d1a422f2fbad9d630f6355253a10f917394ffd572f5c7ac7948983f0081354f7",
      "dataset_fingerprint": "v2:c547e992ce2a3c23d470da85b5dbfd254e1728e2bfd8d51254a00d712521d0d5",
      "dataset_id": "afb2f63d-35ee-478b-a4a6-cfcdfa1d5ce5",
      "group_covariance_sha256": {
        "A": "a554e1324a917aad52f87bd483f05d89665885c76fc6b6fd7caf1fc1a52de85e",
        "B": "c1a43b1cf55b84fe7c6a2f74c9fc0ed8119ce0d579568b643305097e3de01b8e"
      },
      "group_observed_means_sha256": {
        "A": "e09cfb5a11f2cb2114b7d6b251f42ecccce9d6a10eb95d25711fc2583aea1335",
        "B": "f9f6c6010e8bdf17cf8572cf9724f5fe3827791476efb03cc554dfa5541899e7"
      },
      "group_sample_sizes": {
        "A": 180,
        "B": 220
      },
      "shared_complete_case_observations": 400
    },
    "label_swap_check": {
      "absolute_tolerance": 1e-07,
      "configural_chi_square_absolute_difference": 0.0,
      "lrt_absolute_difference": 5.471179065352771e-13,
      "metric_chi_square_absolute_difference": 5.471179065352771e-13,
      "status": "accepted"
    },
    "likelihood_ratio_test": {
      "degrees_of_freedom": 4,
      "statistic": 21.62648233366326,
      "upper_tail_p_value": 0.00023781437354424367
    },
    "method_version": "cbsem_exact_two_group_configural_metric_prerequisite_v1",
    "metric": {
      "chi_square": 38.468587583141165,
      "degrees_of_freedom": 20,
      "free_dimensions": 22,
      "gradient_norm": 2.122707606377918e-07,
      "groups": [
        {
          "chi_square": 20.731575356977103,
          "group": "A",
          "implied_covariance_sha256": "9dd911beb7582265f4f4e8cfe03f12e67cc22389c7f8670b4f2ea93605babf35",
          "objective": 0.1151754186498728,
          "parameters": {
            "factor_covariance_f1_f2": 0.3981237152389084,
            "factor_variance_f1": 1.2922298378988222,
            "factor_variance_f2": 0.8635367427241315,
            "loading_x1": 1.0,
            "loading_x2": 0.6253553598685064,
            "loading_x3": 0.375669672621674,
            "loading_y1": 1.0,
            "loading_y2": 0.7083274045244846,
            "loading_y3": 0.676657211706545,
            "residual_variance_x1": 0.07924635390964489,
            "residual_variance_x2": 0.4048621938006217,
            "residual_variance_x3": 0.6014634173595819,
            "residual_variance_y1": 0.31334291499431727,
            "residual_variance_y2": 0.3268828933951894,
            "residual_variance_y3": 0.3671721542382062
          },
          "sample_size": 180
        },
        {
          "chi_square": 17.73701222616406,
          "group": "B",
          "implied_covariance_sha256": "1447c262601729a85ce87c99af80753c012217ff0089517faf82ba764ef19010",
          "objective": 0.08062278284620028,
          "parameters": {
            "factor_covariance_f1_f2": 0.3049350533557703,
            "factor_variance_f1": 0.9487544764561754,
            "factor_variance_f2": 1.024140548210762,
            "loading_x1": 1.0,
            "loading_x2": 0.6253553598685064,
            "loading_x3": 0.375669672621674,
            "loading_y1": 1.0,
            "loading_y2": 0.7083274045244846,
            "loading_y3": 0.676657211706545,
            "residual_variance_x1": 0.10721714248322653,
            "residual_variance_x2": 0.5150097094255004,
            "residual_variance_x3": 0.3847201563181486,
            "residual_variance_y1": 0.38199241120220906,
            "residual_variance_y2": 0.4253605060956911,
            "residual_variance_y3": 0.49288251721950027
          },
          "sample_size": 220
        }
      ],
      "objective": 0.09617146895785292,
      "observed_moments": 42
    },
    "qualification_status": "engine_only_prerequisite_not_product_qualified",
    "scientific_result_sha256": "fe380fd9f36bc3ebe4391ba1b68fa550387435f029d0542eb9cac781d2fac509"
  },
  "fixture": {
    "dgp": {
      "deliberate_noninvariance": "group_B_x3_loading_0.38_vs_group_A_0.71",
      "factor_correlation": 0.35,
      "generation": "frozen_xorshift32_box_muller_raw_rows_v1",
      "marker_loadings": {
        "x1": 1.0,
        "y1": 1.0
      },
      "nonmarker_loadings": {
        "A": {
          "x2": 0.82,
          "x3": 0.71,
          "y2": 0.78,
          "y3": 0.66
        },
        "B": {
          "x2": 0.82,
          "x3": 0.38,
          "y2": 0.78,
          "y3": 0.66
        }
      },
      "residual_standard_deviations": {
        "x1": 0.55,
        "x2": 0.6,
        "x3": 0.65,
        "y1": 0.58,
        "y2": 0.62,
        "y3": 0.68
      },
      "seed": 539363350
    },
    "group_sample_sizes": {
      "A": 180,
      "B": 220
    },
    "label_swap_path": "validation/fixtures/cbsem_exact_two_group_configural_metric_v1_label_swap.csv",
    "label_swap_sha256": "7170f47d6bd8253b61c499b52cc70e3b9e93070ae1e9001b6b5f7ea8722ce926",
    "label_swap_validation": "exact_numeric_rows_preserved_group_text_values_exchanged",
    "observed_variable_order": [
      "x1",
      "x2",
      "x3",
      "y1",
      "y2",
      "y3"
    ],
    "primary_path": "validation/fixtures/cbsem_exact_two_group_configural_metric_v1.csv",
    "primary_sha256": "909e80665b244d23c1b6aa329a9e0f86e55b21afb5995928fa4310797e2d6d57"
  },
  "kind": "cbsem_exact_two_group_configural_metric_engine_reference_report_v1",
  "lavaan_reference": {
    "reason": "Rscript_not_found",
    "required_contract": {
      "configural_group_equal": [],
      "estimator": "ML",
      "fixed_x": false,
      "marker_identification": true,
      "meanstructure": false,
      "metric_group_equal": [
        "loadings"
      ],
      "missing": "listwise",
      "std_lv": false
    },
    "script_sha256": "968682bdd9e34142fd4c7e876c94e568010beef59638cf675bdfa4f970880c01",
    "status": "unavailable_current_host"
  },
  "manifest_path": "validation/cbsem_exact_two_group_configural_metric_manifest_v1.json",
  "manifest_sha256": "8020910f1bf7e7e40375c13b39a74b9a15178276d71f5703e8acd76e543f5899",
  "python_reference": {
    "configural": {
      "chi_square": 16.84210524994615,
      "degrees_of_freedom": 16,
      "free_dimensions": 26,
      "groups": [
        {
          "chi_square": 8.501617508430925,
          "group": "A",
          "implied_covariance": [
            [
              1.3662810098704121,
              0.7437704218322153,